	title	author	date	url	text	comment_count	fullname	type	co_authors	api_index
0	/r/Football Daily Discussion Thread	Unknown	2024-01-05 22:01:08	https://www.reddit.com/r/football/comments/18ziwlo/rfootball_daily_discussion_thread/	**Welcome to the Daily Discussion Thread!** &#x200B; Use this thread for all your football-related discussions, questions, and tactical analyses. Whether you want to share your thoughts on recent matches, discuss player performances, or dive into the nitty-gritty of tactics, this is the place for you. &#x200B; **Guidelines:** 1. **Be Respectful:** Remember that everyone has their own opinions. Keep discussions civil and respectful. Disagreements are natural, but personal attacks or offensive language will not be tolerated. 2. **Stay On Topic:** This thread is dedicated to football discussions. While some off-topic conversations are okay, try to keep the main focus on the beautiful game. 3. **Encourage Engagement:** If you see an interesting comment or question, feel free to respond and keep the conversation going. This thread is all about community interaction. 4. **Share Insights:** Whether you're a seasoned fan or new to the sport, share your insights and knowledge. Help create a learning environment for everyone. &#x200B; **Discussion Starters:** 1. *What was the standout moment from the latest matches?* 2. *Which player do you think is underrated and deserves more recognition?* 3. *Tactical Analysis: Break down a recent match or discuss your favorite team's playing style.* 4. *Have any burning questions about football rules? Ask away, and let the community help clarify.* 5. *Ticket Questions: Planning to attend a match soon? Need advice on getting tickets or recommendations for the best fan experiences? Ask your ticket-related questions here!* 6. *Getting into Football: New to the sport or looking to deepen your passion for it? Share your journey or ask for tips on how to begin watching football, understanding the rules, or becoming a dedicated fan.* 7. *Jersey Talk: Show off your favorite jerseys, discuss classic kits, or ask for recommendations on where to find the best gear. What's your all-time favorite football jersey?* 8. *VAR or Referee Rants: Frustrated with the latest VAR decisions or referee calls? Vent your feelings here and discuss the impact on the beautiful game.* 9. *Predictions: Share your insights on upcoming matches, player performances, or league outcomes. What are your bold predictions for the season?* &#x200B; Please make sure to read our [latest important update](https://www.reddit.com/r/football/comments/16ph90m/important_update_for_rfootball_elevating_content/) before posting/commenting [Join us on Discord](https://discord.gg/football)	<praw.models.comment_forest.CommentForest object at 0x11e39b280>	t3_18ziwlo	reddit		
1	Zagallo, The Greatest Winner of the World Cups, Passes Away at 92	:Soccer_ball:	2024-01-06 12:58:29	https://www1.folha.uol.com.br/internacional/en/sports/2024/01/zagallo-the-greatest-winner-of-the-world-cups-passes-away-at-92.shtml	Unknown	<praw.models.comment_forest.CommentForest object at 0x11e3993c0>	t3_18zzgvs	reddit		
2	Leverkusen is now the only unbeaten team in Europe this season	:Soccer_ball:	2024-01-06 15:32:56	https://www.reddit.com/r/football/comments/1902gt2/leverkusen_is_now_the_only_unbeaten_team_in/	As of today (after Floriana's defeat in Malta's first division), Bayer Leverkusen is the only senior men's football team, out of all 54 UEFA top-tier leagues, without any defeat in official games in the current 2023/2024 season (or corresponding 2023 season, in applicable cases).	<praw.models.comment_forest.CommentForest object at 0x105a70070>	t3_1902gt2	reddit		
3	Has football gotten more robotic in recent years?	:Soccer_ball:	2024-01-06 15:15:20	https://www.reddit.com/r/football/comments/19023le/has_football_gotten_more_robotic_in_recent_years/	Have only been watching footy seriously for the last ~2 years - last night for some reason my tiktok for you page was feeding me prime r9, Ronaldinho, Zidane, etc edits and got me thinking: is there any players like them in todays game with the same level of class and skill as guys like that or is it just the hand picked moments and clever editing that makes it seem that way? I never actually got to see them play regularly so I wouldn’t know. They seemed to be so creative and different to what I watch day to day. What do you guys think?	<praw.models.comment_forest.CommentForest object at 0x11e4313c0>	t3_19023le	reddit		
4	Is there any way for smaller clubs to ever have a chance to truly compete in world football?	:Soccer_ball:	2024-01-06 14:44:47	https://www.reddit.com/r/football/comments/1901gwb/is_there_any_way_for_smaller_clubs_to_ever_have_a/	I’ll use top 5 for example, we all know the top leagues are dominated as the following: Premier League- Big 6 La Liga- 2 teams and once in a while 3 teams Serie A- Big 6 like Prem Bundesliga- 1 team Ligue 1- 1 team That’s why I think it’d be good for clubs like Girona, Aston Villa, and Bayer Leverkusen to win there leagues as it changes the usual and predictable norm of the same teams winning their league. This could as set a precedent for football as a whole to become more competitive in the future. FFP has been absolutely AWFUL and I think a salary cap wouldn’t work as that would hinder smaller clubs due due the cap in spending. Would a luxury tax work? You break FFP or if you have a salary cap and go over the cap you pay back the league and the league redistributes the money to the rest of the clubs in the league. What do you guys think will smaller clubs ever consistently compete with bigger clubs in their leagues, in the UCL, and in world football as a whole?	<praw.models.comment_forest.CommentForest object at 0x11e4325c0>	t3_1901gwb	reddit		
5	VAR - It's not going away, so how can it be improved?	:Soccer_ball:	2024-01-05 07:27:45	https://i.redd.it/syt38vo7qkac1.jpeg	Every week there is a fresh VAR controversy with many in the game venting their frustration with it. Realistically, the chances of there being a U Turn and removing it from the game completely is close to 0%. So, how can it be made better??	<praw.models.comment_forest.CommentForest object at 0x11e4337f0>	t3_18z1464	reddit		
6	Will Argentina keep the World Cup trophy like Brazil in 1970?	:Soccer_ball:	2024-01-06 08:16:42	https://www.reddit.com/r/football/comments/18zv93y/will_argentina_keep_the_world_cup_trophy_like/	Argentina has won the World Cup 3 times since the introduction of the current trophy in 1974, will they be able to keep it like Brazil in 1970 after winning the Jules rimet trophy thrice?	<praw.models.comment_forest.CommentForest object at 0x11e62cc70>	t3_18zv93y	reddit		
7	It really annoys me that every Best XI voted by FIFA or UEFA (or any other federation) always have players in the wrong positions and doesn't abide by current football meta	:Soccer_ball:	2024-01-05 09:46:20	https://www.reddit.com/r/football/comments/18z36xk/it_really_annoys_me_that_every_best_xi_voted_by/	These TOTY or TOTS XIs usually have 4 strikers, 3 attacking midfielders and 3 defenders (1 of them is a wingback). This is kind of disrespectful to defenders and defensive midfielders. They even have some players in the wrong position. Look up IFFHS Men's World Team 2023, they play Harry Kane as RW, Messi as LM and Alphonso Davies as CB. If these Best XIs played in French Ligue 2, they wouldn't be able to promote to Ligue 1.	<praw.models.comment_forest.CommentForest object at 0x11e62f2e0>	t3_18z36xk	reddit		
8	Sunderland owner 'disgusted and hurt' by Newcastle issue that left fans raging	:Soccer_ball:	2024-01-05 10:15:44	https://talksport.com/football/1700326/sunderland-apology-newcastle-issue-fans-bar/	Unknown	<praw.models.comment_forest.CommentForest object at 0x11e634130>	t3_18z3mj2	reddit		
9	Government will not intervene in Chelsea’s BingX deal despite crypto firm’s Russia links	:Soccer_ball:	2024-01-05 12:38:02	https://www.telegraph.co.uk/football/2024/01/05/government-will-not-intervene-chelsea-bingx-deal-russia/	Unknown	<praw.models.comment_forest.CommentForest object at 0x11e6349a0>	t3_18z5xj3	reddit		
10	Predicting football tables by a maximally parsimonious model	Kjetil Haugen	2018-05-23 02:25:04	http://arxiv.org/abs/1805.08937v1	This paper presents some useful mathematical results involved in football table prediction. In addition, some empirical results indicate that an alternative methodology for football table prediction may produce high quality forecasts with far less resource usage than conventional methods.			arxiv	['Brynjulf Owren']	0.0
11	Network analysis of the worldwide footballer transfer market	Ming-Xia Li	2018-11-01 10:16:15	http://arxiv.org/abs/1811.00300v1	The transfer of football players is an important part in football games. Most studies on the transfer of football players focus on the transfer system and transfer fees but not on the transfer behavior itself. Based on the 470,792 transfer records from 1990 to 2016 among 23,605 football clubs in 206 countries and regions, we construct a directed footballer transfer network (FTN), where the nodes are the football clubs and the links correspond to the footballer transfers. A systemic analysis is conduced on the topological properties of the FTN. We find that the in-degrees, out-degrees, in-strengths and out-strengths of nodes follow bimodal distributions (a power law with exponential decay), while the distribution of link weights has a power-law tail. We further figure out the correlations between node degrees, node strengths and link weights. We also investigate the general characteristics of different measures of network centrality. Our network analysis of the global footballer transfer market sheds new lights into the investigation of the characteristics of transfer activities.			arxiv	['Wei-Xing Zhou', 'H. Eugene Stanley']	1.0
12	Networks of international football: communities, evolution and globalization of the game	Yang Li	2022-05-21 13:43:18	http://arxiv.org/abs/2205.10599v1	As the most popular sport around the globe, the game of football has recently intrigued much research interest to explore and distill useful and appealing information from the sport. Network science and graph-centric methods have been previously applied to study the importance of football players and teams. In this paper, for the first time we study the macroscopic evolution of the football society from a complex network point of view. Football game records within a time window of over a century were collected and expressed in a graph format, where participant teams are represented by graph nodes and the games between them are the graph edges. We carry out community detection and temporal analysis to reveal the dynamic features and the community structures embedded within the football network, offering the evidence of a continuously expanding football society. Spatio-temporal analysis is also implemented to unveil the temporal states that represent distinct development stages in the football history. Our analysis suggests that the evolution of the game receives considerable impact not only from major sport events, but also from multiple social and political incidents. The game of football and its evolution reflect significant historical transitions and turning points, and can provide a novel perspective for the study of the worldwide globalization process.			arxiv	['Gonzalo Mateos']	2.0
13	The classification of football patterns	V. Braungart	2006-06-08 16:14:44	http://arxiv.org/abs/math/0606193v1	We prove that every spherical football (also known as a spherical soccer ball) is a branched cover, branched only in the vertices, of the standard football made up of 12 pentagons and 20 hexagons. We also give examples showing that the corresponding result is not true for footballs of higher genera. Moreover, we classify the possible pairs (k,l) for which football patterns on the sphere exist satisfying a natural generalisation of the usual incidence relation between pentagons and hexagons to k-gons and l-gons.			arxiv	['D. Kotschick']	3.0
14	Small angle limits of Hamilton's footballs	Yanir A. Rubinstein	2019-05-02 17:27:24	http://arxiv.org/abs/1905.00865v1	Compact Ricci solitons on surfaces have at most two cone points, and are known as Hamilton's footballs. In this note we completely describe the degenerations of these footballs as one or both of the cone angles approaches zero. In particular, we show that Hamilton's famous non-compact cigar soliton is the Gromov--Hausdorff limit of Hamilton's compact conical teardrop solitons.			arxiv	['Kewei Zhang']	5.0
15	Seasonal Linear Predictivity in National Football Championships	Giuseppe Jurman	2015-11-19 17:14:28	http://arxiv.org/abs/1511.06262v1	Predicting the results of sport matches and competitions is an arising research field, benefiting from the growing amount of available data and the novel data analytics techniques. Excellent forecasts can be achieved by advanced machine learning methods applied to detailed historical data, especially in very popular sports such as football (soccer). Here we show that, despite the large number of confounding factors, the results of a football team in longer competitions (e.g., a national league) follow a basically linear trend useful for predictive purposes, too. In support of this claim, we present a set of experiments of linear regression on a database collecting the yearly results of 707 teams playing in 22 divisions from 11 countries, in 20 football seasons.			arxiv	[]	6.0
16	Pricing Football Players using Neural Networks	Sourya Dey	2017-11-16 00:14:49	http://arxiv.org/abs/1711.05865v2	We designed a multilayer perceptron neural network to predict the price of a football (soccer) player using data on more than 15,000 players from the football simulation video game FIFA 2017. The network was optimized by experimenting with different activation functions, number of neurons and layers, learning rate and its decay, Nesterov momentum based stochastic gradient descent, L2 regularization, and early stopping. Simultaneous exploration of various aspects of neural network training is performed and their trade-offs are investigated. Our final model achieves a top-5 accuracy of 87.2% among 119 pricing categories, and places any footballer within 6.32% of his actual price on average.			arxiv	[]	7.0
17	Predictive modelling of football injuries	Stylianos Kampakis	2016-09-20 11:58:42	http://arxiv.org/abs/1609.07480v1	The goal of this thesis is to investigate the potential of predictive modelling for football injuries. This work was conducted in close collaboration with Tottenham Hotspurs FC (THFC), the PGA European tour and the participation of Wolverhampton Wanderers (WW). Three investigations were conducted: 1. Predicting the recovery time of football injuries using the UEFA injury recordings: The UEFA recordings is a common standard for recording injuries in professional football. For this investigation, three datasets of UEFA injury recordings were available. Different machine learning algorithms were used in order to build a predictive model. The performance of the machine learning models is then improved by using feature selection conducted through correlation-based subset feature selection and random forests. 2. Predicting injuries in professional football using exposure records: The relationship between exposure (in training hours and match hours) in professional football athletes and injury incidence was studied. A common problem in football is understanding how the training schedule of an athlete can affect the chance of him getting injured. The task was to predict the number of days a player can train before he gets injured. 3. Predicting intrinsic injury incidence using in-training GPS measurements: A significant percentage of football injuries can be attributed to overtraining and fatigue. GPS data collected during training sessions might provide indicators of fatigue, or might be used to detect very intense training sessions which can lead to overtraining. This research used GPS data gathered during training sessions of the first team of THFC, in order to predict whether an injury would take place during a week.			arxiv	[]	8.0
18	Explaining the difference between men's and women's football	Luca Pappalardo	2021-01-05 17:25:53	http://arxiv.org/abs/2101.01662v1	Women's football is gaining supporters and practitioners worldwide, raising questions about what the differences are with men's football. While the two sports are often compared based on the players' physical attributes, we analyze the spatio-temporal events during matches in the last World Cups to compare male and female teams based on their technical performance. We train an artificial intelligence model to recognize if a team is male or female based on variables that describe a match's playing intensity, accuracy, and performance quality. Our model accurately distinguishes between men's and women's football, revealing crucial technical differences, which we investigate through the extraction of explanations from the classifier's decisions. The differences between men's and women's football are rooted in play accuracy, the recovery time of ball possession, and the players' performance quality. Our methodology may help journalists and fans understand what makes women's football a distinct sport and coaches design tactics tailored to female teams.			arxiv	['Alessio Rossi', 'Giuseppe Pontillo', 'Michela Natilli', 'Paolo Cintia']	9.0
19	How does AI play football? An analysis of RL and real-world football strategies	Atom Scott	2021-11-24 08:44:23	http://arxiv.org/abs/2111.12340v1	Recent advances in reinforcement learning (RL) have made it possible to develop sophisticated agents that excel in a wide range of applications. Simulations using such agents can provide valuable information in scenarios that are difficult to scientifically experiment in the real world. In this paper, we examine the play-style characteristics of football RL agents and uncover how strategies may develop during training. The learnt strategies are then compared with those of real football players. We explore what can be learnt from the use of simulated environments by using aggregated statistics and social network analysis (SNA). As a result, we found that (1) there are strong correlations between the competitiveness of an agent and various SNA metrics and (2) aspects of the RL agents play style become similar to real world footballers as the agent becomes more competitive. We discuss further advances that may be necessary to improve our understanding necessary to fully utilise RL for the analysis of football.			arxiv	['Keisuke Fujii', 'Masaki Onishi']	10.0
20	Luke Williams leaves Notts County FC for Swansea City after 18 months in charge	:Soccer_ball:	2024-01-05 18:57:15	https://amp.theguardian.com/football/2024/jan/05/swansea-appoint-luke-williams-head-coach-notts-county	Unknown	<praw.models.comment_forest.CommentForest object at 0x11e637550>	t3_18zeh2b	reddit		
21	Which team will get gutted the most at the end of the season?	:Soccer_ball:	2024-01-05 01:39:54	https://www.reddit.com/r/football/comments/18yuhjk/which_team_will_get_gutted_the_most_at_the_end_of/	There have been many underdogs and shock contenders across the world of football. Girona, Aston Villa, Nice, Bologna, Leverkusen, Stuttgart etc. And many of the top clubs will be looking to raid these clubs for their talent. But which club will get gutted the most? EDIT - Forgot to include PSV, Bilbao and Fiorentina.	<praw.models.comment_forest.CommentForest object at 0x11e637970>	t3_18yuhjk	reddit		
22	"""Club sources said more than 800 right-backs were tracked before"""	:Soccer_ball:	2024-01-04 17:02:05	https://www.reddit.com/r/football/comments/18yhyz5/club_sources_said_more_than_800_rightbacks_were/	"https://www.bbc.co.uk/sport/football/67879910 Just reading this article from the BBC and contains the following: ""Club sources said more than 800 right-backs were tracked before they made the Croydon-born player their fifth most expensive signing."" If that is true how the hell can a club monitor over 800 people for one position? How many are there then for every other position? I'm genuinely curious as to how that can be achieved. How can data like that be gathered and who would be inputting this kind of data."	<praw.models.comment_forest.CommentForest object at 0x11e6a6650>	t3_18yhyz5	reddit		
23	DCL - Palace vs Everton... red card nonsense.	:Soccer_ball:	2024-01-04 21:38:06	https://www.reddit.com/r/football/comments/18yopl9/dcl_palace_vs_everton_red_card_nonsense/	If that's a red card, then the game has gone. Not a supporter of either team btw. That was bullshit.	<praw.models.comment_forest.CommentForest object at 0x11e6f9de0>	t3_18yopl9	reddit		
24	Which football clubs don’t have shirt sponsors?	:Soccer_ball:	2024-01-04 19:16:11	https://www.reddit.com/r/football/comments/18yl9bj/which_football_clubs_dont_have_shirt_sponsors/	If anyone has a list of all the teams without a shirt sponsor for this season, would be very grateful.	<praw.models.comment_forest.CommentForest object at 0x11e70ca60>	t3_18yl9bj	reddit		
25	How does AI play football? An analysis of RL and real-world football strategies	Atom Scott	2021-11-24 08:44:23	http://arxiv.org/abs/2111.12340v1	Recent advances in reinforcement learning (RL) have made it possible to develop sophisticated agents that excel in a wide range of applications. Simulations using such agents can provide valuable information in scenarios that are difficult to scientifically experiment in the real world. In this paper, we examine the play-style characteristics of football RL agents and uncover how strategies may develop during training. The learnt strategies are then compared with those of real football players. We explore what can be learnt from the use of simulated environments by using aggregated statistics and social network analysis (SNA). As a result, we found that (1) there are strong correlations between the competitiveness of an agent and various SNA metrics and (2) aspects of the RL agents play style become similar to real world footballers as the agent becomes more competitive. We discuss further advances that may be necessary to improve our understanding necessary to fully utilise RL for the analysis of football.			arxiv	['Keisuke Fujii', 'Masaki Onishi']	10.0
26	Transformer-Based Neural Marked Spatio Temporal Point Process Model for Football Match Events Analysis	Calvin C. K. Yeung	2023-02-18 10:02:45	http://arxiv.org/abs/2302.09276v1	With recently available football match event data that record the details of football matches, analysts and researchers have a great opportunity to develop new performance metrics, gain insight, and evaluate key performance. However, most sports sequential events modeling methods and performance metrics approaches could be incomprehensive in dealing with such large-scale spatiotemporal data (in particular, temporal process), thereby necessitating a more comprehensive spatiotemporal model and a holistic performance metric. To this end, we proposed the Transformer-Based Neural Marked Spatio Temporal Point Process (NMSTPP) model for football event data based on the neural temporal point processes (NTPP) framework. In the experiments, our model outperformed the prediction performance of the baseline models. Furthermore, we proposed the holistic possession utilization score (HPUS) metric for a more comprehensive football possession analysis. For verification, we examined the relationship with football teams' final ranking, average goal score, and average xG over a season. It was observed that the average HPUS showed significant correlations regardless of not using goal and details of shot information. Furthermore, we show HPUS examples in analyzing possessions, matches, and between matches.			arxiv	['Tony Sit', 'Keisuke Fujii']	11.0
